{
  "annotation_protocol": "multi-rater adjudication with one pass arbitration.",
  "created_at_utc": "2026-04-23T00:00:00Z",
  "curation_notes": [
    "Seed corpus used for hackathon stage.",
    "500 synthetic seed cases are generated per split at default for the ambitious hackathon state."
  ],
  "dataset_id": "bioguard-biosession",
  "description": "Seed BioSession release used for hackathon validation.",
  "files": [
    {
      "num_items": 500,
      "path": "/Users/jasontang/bioguard/artifacts/data/biosession-500-train.jsonl",
      "sha256": "4b6d6723078730999e30f36ad370f988847e9a80e8a8d77a1eeb52b2bad45e8d",
      "split": "train"
    },
    {
      "num_items": 500,
      "path": "/Users/jasontang/bioguard/artifacts/data/biosession-500-dev.jsonl",
      "sha256": "4b6d6723078730999e30f36ad370f988847e9a80e8a8d77a1eeb52b2bad45e8d",
      "split": "dev"
    },
    {
      "num_items": 500,
      "path": "/Users/jasontang/bioguard/artifacts/data/biosession-500-test.jsonl",
      "sha256": "4b6d6723078730999e30f36ad370f988847e9a80e8a8d77a1eeb52b2bad45e8d",
      "split": "test"
    }
  ],
  "license": "CC-BY-4.0",
  "manifest_version": "1.0",
  "quality_gates": {
    "adjudication_rounds": 2,
    "max_unresolved_conflicts": 0.08,
    "min_interrater_alpha": 0.72
  },
  "rater_guideline_version": "bkt-guideline-v1.0",
  "source_reference": "https://example.org/bioguard/manifest-source",
  "splits": {
    "dev": 500,
    "test": 500,
    "train": 500
  },
  "tiers": [
    "tier-1-novice",
    "tier-2-capable",
    "tier-3-advanced",
    "tier-cbrn"
  ],
  "updated_at_utc": "2026-04-23T16:59:53Z",
  "version": "v0.1"
}
